"jornaldopovo.com.br","todos faceiros abanando os rabinhos repetindo roboticamente (pois são lavados) sim querido mestre dos mestres o que","é para nós fazermos","? </s><s> Conclusão: Hoje no Brasil está valendo a pena roubar (tirar o que está em casa alheia ou o que outrem leva consigo,"
"jornaldopovo.com.br","que não se deve julgar ainda mais a distância, pois a internet ajuda em muitas e muitas coisas, mas ainda não pode ser","usada para nós trazer","a realidade fora do virtual. </s><s> Digo isso pois o colunista fez um julgamento virtual do companheiro Olívio descrevendo-o"
"blognasocial.com.br",". </s><s> Eu, meu marido e um amigo nosso, brasileiros nativos [estávamos] falando nossa língua, ela veio gritando que","era para nós pararmos","de falar nossa língua nativa enquanto estivesse no ''país dela''"", publicou. </s><s> Segundo o marido da maquiadora, Gabriel"
"jesocarneiro.com.br","em média R$ 2_mil"", explicou o secretário. </s><s> ""Estamos aguardando que o Tribunal de Justiça possa realizar um esforço","concentrado para nós instruirmos","e julgarmos todos os presos provisórios"". </s><s> Segundo Jarbas, cerca de 5_mil presos ainda não possuem sentenças"
"jornaldopovo.com.br","de rádio para reclamar a rejeição e de uma de suas propostas. </s><s> Te coisas que eu sei e não falo no rádio. </s><s> É assim que deve","ser para nós mantermos","um bom relacionamento, ameaçou o petebista. </s><s> O que é dither (ou dithering) e o bitrate (ou bit rate) no áudio? </s><s> Para dar"
"jesocarneiro.com.br","por ""estudante"" profissional chamado de Israel. </s><s> Em meados do ano passado, esse rapaz esteve na escola onde nós","estudávamos para nós informar","que a lei orgânica do município de Santarém havia sido alterada e que nós, estudantes do EAD, da área tecnológica,"
"jesocarneiro.com.br","mais, não é uma arte somente, é uma arte com objetivo de venda. ""arte"" como voce fala tinha aos montes nas amostras que foi","colocada para nós julgarmos",", tinha até logo com paisagem na imagem, cheia de detalhes, com boto, muiraquitã, encontro das aguas, igreja matriz"
"blognasocial.com.br","Sul, Tarso Genro (PT), afirmou que acata e respeita a decisão das urnas e desejou uma ""boa gestão"" ao seu opositor. ""Não","era para nós ganharmos",". </s><s> Está demonstrado que o povo do Rio Grande queria mudanças e agora vai explorar outros caminhos. </s><s> Cabe a nós"
"jesocarneiro.com.br","não fique ""parazinho"" (que idiotice). </s><s> Não estou fazendo este relato para esmorecer ninquem, muito pelo contrário,","é para nós empenharmos","com afinco nessa etapa final. </s><s> Um bom domingo a todos. </s><s> Concluindo a pergunta que eu fiz eu queria completar dizendo; que"
"papodecinema.com.br","no esporte. </s><s> As Olimpíadas foram uma grande farsa, com mentiras que estão aparecendo agora, esse legado desleixado que","ficou para nós carregarmos",". </s><s> Tudo se perdendo, aquela Floresta dos Atletas, no Rio de Janeiro, que talvez nunca venha a existir. </s><s> É um paralelo com a"
"blognasocial.com.br","é motivo de muita alegria"", disse. ""Inclusive eu considero que o Parreira também tem uma contribuição nisso."" </s><s> ""Vamos","torcer para nós irmos","bem na Copa das Confederações e fazer uma final com a Espanha. </s><s> Seria uma coisa maravilhosa a gente ganhar da Espanha em"
"uol.com.br",", sempre exigindo a responsabilização dos culpados e mudanças no setor aéreo. </s><s> Mesmo diante da dificuldade que","é para nós relembrar","a cada dia, e a cada reunião toda esta tragédia que resultou na perda de nossos amados, nos mantemos unidos porque, acima"
"jesocarneiro.com.br",": 6 meses </s><s> Um comentário em: Estado investirá R$ 2,3_milhões em reforma de escola em Terra Santa </s><s> Desse montante que foi","financiado para nós pagarmos",", quanto será que a construtora vai repassar para o caixa 2 da campanha do candidato do safado velho no próximo ano, seria"
"brasildefato.com.br","ser mais abrangente, mais incisivo e nós deveríamos nos apropriar mais de recursos públicos ainda que essa conta","fique para nós resolvermos","mais tarde"". </s><s> Contrato 36/2016 </s><s> Dados do Contrato </s><s> Signatário </s><s> ELISON JOSÉ MOREIRA - ME (07.247.170/0001-14) </s><s> Objeto </s>"
"uol.com.br","possibilidade de conversar com o ex-presidente Lula, a não ser que eles evacuem a sala, tirem o ex-presidente de lá e o","escondam para nós entrarmos",". </s><s> Mas aí não tem o menor sentido"", afirmou. </s><s> Em coletiva de imprensa concedida no final da tarde desta segunda, o senador"
"uol.com.br","."" Ele diz alguma coisa, mas não é possível compreender, mas parece ser um pedido para ser solto. ""Não, a gente não vai te","soltar para tu bater","em nós de novo"", complementa Adriana. </s><s> Entenda o caso </s><s> Depoimentos de duas funcionárias do mercado obtidos pelo UOL"
"uol.com.br","a Argentina de Messi. </s><s> ""Você sabe o imenso dano que nos fez ao acertar essa bola no minuto 112 da final? </s><s> Você sabe o que teria","significado para nós ser","campeões no Maracanã?"", diz um trecho da carta. </s><s> ""Seria uma vitória eterna no clássico contra Brasil, mesmo que eles"
"uol.com.br","da seleção. </s><s> Nós estamos cientes de que eles estão seguindo os protocolos alinhados com a Uefa. </s><s> Não seria","apropriado para nós acrescentarmos","comentários neste momento"", disse o clube alemão à Sky Sports News. </s><s> O Chelsea não chegou a comentar sobre a situação"
"hojeemdia.com.br","e não penal. </s><s> Ele considera que a análise será restrita à questão sobre uso pessoal de drogas ser ou não crime. ""Não","dá para nós definirmos","neste julgamento quem é usuário e quem é traficante"", comentou. </s><s> Para ele, essa distinção tem de ser feita caso a caso"
"hojeemdia.com.br","o feito. ""Classificadas para a Olimpíada de Inverno. </s><s> Um sonho que se tornará realidade. </s><s> Quero agradecer a todos que","torceram para nós estarmos","lá"", escreveu Sally Silva, em sua página no Facebook. ""Não tenho nem palavras para descrever o que estou sentindo, é uma"
"hojeemdia.com.br",". ""O médico a analisou e disse que as contrações ainda estavam poucas, mas quando aumentassem para oito a cada meia hora,","era para nós voltarmos",""", contou. </s><s> Porém, ao chegar em casa, ele afirma que Zenilda sentia muita dor. </s><s> Por isso decidiram retornar ao hospital. </s>"
"hojeemdia.com.br","O público queria esse encontro. </s><s> Uma vez, nos anos 80, encontrei com o Ney e ele me disse que as pessoas vinham lhe dizer que","era para nós fazermos","algo juntos. </s><s> O meu público dizia o mesmo. </s><s> Só agora realizamos esse desejo"", diz a mineira de Cataguases, que saiu de"
"hojeemdia.com.br","tributando mal e erradamente aqui em Minas os produtos mineiros. </s><s> Eu acho que isso faz parte de uma revisão que tem que ser","feita para nós atrairmos","novas empresas para cá. </s><s> Aqui na região Centro-Oeste é um exemplo, nós temos em Divinópolis 17 ou 18 guseiras,"
"esquerdadiario.com.br","como melhor expressar essa raiva, que também sentimos, do podre e corrupto sistema político brasileiro. </s><s> Uma delas","é para nós fortalecer","as vozes de candidaturas do MRT pelo PSOL que defendem entre outras coisas que ""todo político ganhe como uma professora"
"esquerdadiario.com.br","na velocidade dos seus movimentos para desenroscar a máquina. </s><s> Alguns de nós corremos para ajuda-lo, assim como ele","corria para nós ajudar","quando as gavetas estavam pra secar enquanto nas nossas mãos, as dezenas de pequenos cortes de papel, ardiam. </s><s> Depois de"
"jornalcontabil.com.br","que o trato fosse respeitado. </s><s> Além disso, o universo de possibilidades era extremamente limitado, pois seria muito","complicado para nós trocar","os débitos de uns pelos dos outros, como fazemos sem nem sequer perceber hoje em dia. </s><s> De forma racional e"
"esquerdadiario.com.br","disse ainda que ""fica cada vez mais claro que a atual estrutura política está podre e carcomida pela corrupção. </s><s> Não","bastará para nós trocar","os personagens de cima em uma eleição dentro desse sistema, com esse congresso corrupto e um judiciário cada vez mais"
"esquerdadiario.com.br","<s> Em face desta tragédia, alguns vão chamar para as orações. </s><s> Alguns vão chamar para o amor. </s><s> Alguns vão chamar para a paz. </s><s> Eu","chamo para nós organizar","com o espírito de Stonewall - exigindo que nenhum de nós seja morto e reconhecendo que os nossos problemas não são"
"diarioonline.com.br","esperava vencer e ser mais rápido que a Mercedes [em Sepang], mas acho que fomos bem. </s><s> Claro que no classificatório é mais","complicado para nós estarmos","na frente deles, mas sabemos que na corrida nosso carro é mais forte e conseguimos cuidar bem dos pneus"", afirmou"
"diarioonline.com.br","pegar o aparelho, vimos que estava muito engraçado. </s><s> Mandamos em grupos de amigos e família, que também se divertiram e","pediram para nós compartilharmos","nas redes sociais. </s><s> Até agora tem mais de 4_milhões de visualizações e até pessoas da África já assistiram. </s>"
"anovademocracia.com.br","de choque, no dia em que fomos presos na Câmara, veio determinada a agir com violência. </s><s> Quando os oficiais começaram a","pedir para nós sentarmos","e calarmos a boca, percebi que aquilo não iria terminar na delegacia. </s><s> Nós éramos umas 200 pessoas e, depois que os ônibus"
"anovademocracia.com.br","países. </s><s> As imagens eram filmadas, reveladas, copiadas e enviadas para o mundo inteiro. </s><s> Ou seja, imagine quanto tempo","demorava para nós vermos","as imagens da Batalha de Stalingrado! </s><s> De qualquer forma, há tempos existem pessoas como vocês, que vão para o campo de"
"anovademocracia.com.br","6 pessoas, que não me falha a memória. </s><s> Quando não conseguiram as respostas que queriam, eles começaram esse processo de","pedir para nós retirarmos","uma trouxa de cada barraco, uma trouxa por família. </s><s> Em determinado momento perguntaram se havia líder, onde estava o"
"estadao.com.br","the Front, projetistas de todo o mundo, muitos jovens e desconhecidos, que privilegiam do coletivo ao individual. ""","Interessa para nós saber","da luta daqueles que conseguiram vencer a inércia da realidade e extrair lições tiradas daqueles momentos críticos"
"estadao.com.br",", Elizabeth Banks (As Panteras) e Laure de Clermont-Tonerre (The Mustang). </s><s> ""Hollywood está derrubando os portões e os","abrindo para nós entrarmos",""", disse ela. </s><s> Quem dera todas as instituições que realizam premiações fizessem o mesmo. </s><s> Os pontos de vista de grandes"
"anovademocracia.com.br","mais importante e decisivo é o homem, o homem e a sua ideologia, é servir a uma classe, servir ao povo''. </s><s> Então, teatro","é para nós servir","ao povo, porque realmente estamos servindo, levando uma Nova Cultura para ele e despertando um novo pensamento –"
"campograndenews.com.br","município designou que a própria concessionária alimente o sistema. ""Até 2014 não éramos nós que digitávamos. </s><s> Até que","pediram para nós digitarmos","os resultados no sistema. </s><s> Além de digitar, nós também entregamos o relatório para a vigilância sanitária"", afirma ela"
"uol.com.br","aprovaria, grande momento."", escreveu May. </s><s> ""Além disso, vou dizer isso apenas uma vez, imaginem o quão horrível teria","sido para nós fazermos","uma turnê com um imitador do Freddie. </s><s> Qualquer um que sugerir isso não pertence isso"", concluiu. </s><s> Veja o que fazer em San"
"uol.com.br","amigos, é divertido. </s><s> Os shows aí foram muito, muito memoráveis. </s><s> E isso é sobre os fãs. </s><s> Vocês são grandes fãs de música, e é","divertido para nós estar","aí. </s><s> A. o processo de emenda do PPR exige equipamento específico e forma um elemento único que praticamente impede"
"uol.com.br","Unidos. </s><s> ""¡Quatro! traz os nossos fãs um passo mais próximos de nós, dando a eles ainda mais acesso e revelando como","foi para nós fazer","esses discos"", afirmou o baixista Mike Dirnt em um comunicado. </s><s> Os melhores momentos do documentário serão"
"uol.com.br",""" acrescenta o guitarrista. ""Nem eu nem Rick somos pessoais verbais e, então, Polly estava pensando que era muito","apropriado para nós expressarmos","o que sentimos pela música. </s><s> Ela está nos ajudando a descrever isso com palavras também"". </s><s> Ouça ""Louder Than Words"""
"uol.com.br","precisavam de 30% de candidatas mulheres e colocavam muitas esposas, amigas, só pra ocupar o posto. </s><s> Esses 30% deviam","ser para nós assumirmos","cadeiras, não só sermos candidatas. </s><s> É uma grande ilusão. </s><s> Eu fico revoltada, indignada"", lamenta. </s><s> Mas os médicos de"
"tagview.com.br","bagunçamos ou falamos nada, sempre apoiamos o time. </s><s> Aí chegamos aqui hoje, justamente até para motivar o time, está","fechado para nós entrar",". </s><s> Quem tomou essa atitude não condiz de levar o torcedor para o estádio"", criticou. </s><s> A atitude foi compartilhada pelo"
"tagview.com.br","boletim de ocorrência por ameaça e danos. </s><s> E vamos no IML solicitar perícia e depois levar para a Ouvidoria. </s><s> Disseram que","era para nós pedirmos","indenização do Estado"", explicou a moradora Raimunda. </s><s> Em nota, a PM informou que ""foi enviada ao local com a finalidade"
"tagview.com.br","do site, além de rumar para outro país. </s><s> ""Hoje eu sou professor e o Thiago está fazendo mestrado em Portugal. </s><s> Fica muito","puxado para nós avaliarmos","todos os pedidos de cadastro que recebemos dia a dia. </s><s> Para 2013, queremos chamar mais pessoas para trabalhar conosco,"
"tagview.com.br","jogo, precisamos dessa vitória. </s><s> Só com o calor da torcida é que você pode conseguir. </s><s> É ótimo que eles compareçam, que","venham para nós fazermos","uma boa partida. </s><s> 3o Com a vitória, dependendo de outros resultados, o Vasco pode ficar até no topo da tabela de"
"tagview.com.br","o crack. ""A resposta que estamos dando aos problemas relacionados com a vulnerabilidade dessas pessoas é a prisão. </s><s> Não","dá para nós mantermos","um sistema de aprisionamento em massa. </s><s> É inviável"", constata. </s><s> Velocista Ana Cláudia Lemos pode ficar fora da Rio 2016"
"tagview.com.br",": ela está grávida de 9 meses. ""Eu e meu marido somos pastores e morávamos com nossos filhos de 3 e 5 anos. </s><s> Os policiais","pediram para nós sairmos","de dentro da casa e depois só vimos o fogo, e não deu pra salvar nada. </s><s> Tivemos minha casa perdida e tudo o que tinha dentro:"
"tagview.com.br","povo, os nossos parentes, mas todos aqueles que foram prejudicados por esse ocorrido"", disse ele. </s><s> Frase </s><s> ""Os policiais","pediram para nós sairmos","de dentro da casa; depois só vimos o fogo. </s><s> Não deu pra salvar nada. </s><s> Perdemos tudo"" (Patriciana Arcanjo, pastora) </s>"
"tagview.com.br","água para beber e até mesmo para misturar o cimento, quando a empresa fornece água, ela está suja. </s><s> A cesta básica que","era para nós recebermos",", nunca foi dada aos funcionários, além do atraso do salário e a alimentação ruim servida aos trabalhadores'''', falou"
"correiodopapagaio.com.br",", na tentativa de promover a fusão das duas empresas. </s><s> Agora, o Hermes Pardini prepara-se para abrir o capital. ""Não","adiantava para nós tirar","o foco da empresa e fazermos aquisições num momento em que as margens estavam caindo"", disse. ""Agora queremos trazer de"
"uol.com.br","e às estradas AM-010, que liga Manaus a Itacoatiara, e BR-174, que liga Manaus a Boa Vista. </s><s> ""Essa é uma obra para a Copa,","será para nós melhorarmos","o acesso ao aeroporto, dando opção para quem vai em direção a Rio Preto da Eva e Itacoatiara, além de criarmos retornos"
"correiodopapagaio.com.br","de 60 policiais militares. </s><s> Caso seja necessário aumentar o policiamento, outros 700 PMs estão de sobreaviso. ""","É para nós mantermos","a ordem se houver a possibilidade de empregar a força"", afirmou o coronel. </s><s> Todos os pelotões estão com equipamentos"
"correiodopapagaio.com.br","e amigos eles perguntam como está a nossa preparação, estão ansiosos pelo jogo. </s><s> Aqui dentro é onde menos se fala. </s><s> O Tite","falou para nós focarmos","o Brasileiro"", comentou o Fábio Santos, lateral do Corinthians. </s><s> O grande conselho para os torcedores mais tensos é"
"conexaojornalismo.com.br","do Centro de Referência da Cultura Indígena no mesmo local. </s><s> ""Gostamos muito do terreno, o espaço é grande, vai","dar para nós fazermos","as ocas"", contou o índio Afonso Apurinã, depois de ter visitado o local na sexta-feira (22). </s><s> Depois de saíram da Aldeia"
"conexaojornalismo.com.br","da tecnologia da informação, muitos desses dados puramente descritivos talvez sejam feitos por uma máquina. </s><s> O que vai","ficar para nós seres","humanos é fazer matérias com mais charme, emoção e reflexão"". </s><s> DESMANDOS NA SESAU: ''CPI não prende, mas já tem material"
"esportealternativo.com.br","não nos importamos. </s><s> Descobrimos que o menino amava o Buzz Lightyear. </s><s> Nós escolhemos o cachorro no mesmo dia e pareceu","apropriado para nós nomeá-lo","em homenagem a Daniel"". </s><s> Além da visita ao Sítio Histórico, semanalmente, estão sendo realizadas reuniões entre"
"esportealternativo.com.br","Resende, que se destacou principalmente com o esquema 5-1, explicou o objetivo da mudança na marcação. ""O Cubano","pediu para nós fazermos","a marcação 5-1, porque o Canadá tocava muito a bola e os árbitros demoravam para dar o passivo. </s><s> Então ele colocou uma"
"esportealternativo.com.br","Tandara comentou sobre a importância desses amistosos na preparação do Brasil para o Grand Prix. ""Esses amistosos","serviram para nós sentirmos","a evolução que tivemos do torneio de Montreux para o nosso momento atual. </s><s> Isso pode ter feito a diferença para"
"camacarifatosefotos.com.br","nós informar, e se não é possível ter acesso a esta informação em casa, é necessário procurarmos as instituições","adequadas para nós guiarem",". </s><s> Quando se trata de sexualidade, da busca por expressar prazer, o assunto é sério. </s><s> Nesta quarta-feira (23), será"
"uol.com.br",", a grande novidade é o último episódio. </s><s> Mas como ele ainda não está fechado, eu não posso falar. </s><s> Mas você imagina como","é para nós encerrar","a última temporada do Tá no Ar. </s><s> Todo ano a gente termina com um especial, mas encerrar mesmo a temporada é difícil. </s><s> Eu"
"estadao.com.br",", Coy Ferreira deixava sua filha na escola quando ouviu os tiros. ""Um dos professores veio correndo em minha direção e","disse para nós entrarmos","rapidamente, pois um atirador estava a caminho"", disse ele à televisão local, KRCR. ""Saímos correndo e entramos na"
"estadao.com.br","é uma oportunidade de nomear líderes agrícolas urbanos que estão aqui para ensiná-los e falar a respeito de como tem","sido para nós cultivar","algo nesta paisagem''"". </s><s> Com dois aprendizes, ela está usando técnicas de agricultura urbana para cultivar mudas de"
"ambientebrasil.com.br",". </s><s> O volume morto é a água que fica abaixo das comportas do reservatório e precisa ser captada por bombas. </s><s> ""Ainda não","dá para nós dizermos","com segurança absoluta que estamos fora dessa crise. </s><s> Por isso que é importante a população continuar engajada nesse"
"ambientebrasil.com.br","não tem televisão, não tem energia e nem escola"". </s><s> O colono Antônio Costa, completou que ""quando eles [fiscais do Ibama]","pedirem para nós sairmos","vamos alegar que precisamos de um lugar para morar e trabalhar, porque jogar a gente na rua não pode"". </s><s> O coordenador da"
"ambientebrasil.com.br","aceitou o acordo em 1997 para reduzir a emissão em 7% até 2012, mas nunca mandou o texto para ratificação no Senado. </s><s> ""Não","serve para nós chegar","a um acordo internacionalmente e esperar que nosso Congresso aprove isso"", disse Harlan Wilson, negociador-chefe"
