"clicrbs.com.br","são as cores da camisa. </s><s> Foi covarde, bateu, foi beneficiado por uma bandeirinha que inventou dois impedimentos,","era para nós termos","feito 4 a 0 ou 5 a 0. </s><s> Informado sobre as declarações de Montenegro, o técnico do Figueirense, Mário Sérgio, evitou a troca"
"clicrbs.com.br","e Grêmio </s><s> – Se a diretoria do Palmeiras está oferecendo a mala-preta para o Sport, eu não vejo nenhum problema. </s><s> Tudo que","for para nós ajudar","a conquistar a vaga na Libertadores é importante – afirma o lateral-direito Wendel. </s><s> O time comandado por Caio Jr."
"clicrbs.com.br",", às 16h, no Estádio Olímpico. </s><s> – Nós estamos preparados. </s><s> Nesse pouco tempo de trabalho, procurei posicionar bem a","equipe para nós conseguirmos","um bom resultado. </s><s> Estou confiando muito. </s><s> Confio também na nossa direção, no trabalho, nesse projeto desse clube. </s><s> Me"
"clicrbs.com.br","lateral Gilberto. </s><s> – Não foi um resultado ruim, nós conseguimos criar as chances, mas a bola não entrou. </s><s> No segundo tempo","faltou para nós pressionar","um pouco mais para conseguir o segundo gol – disse Gilberto. </s><s> O Palmeiras venceu o Fluminense com facilidade nesta"
"clicrbs.com.br","petistas e de partidos que apóiam o governo federal, como PSB, PMDB, PPS e PTB, no segundo turno. </s><s> – O presidente","pediu para nós darmos","sustentação aos companheiros do partido e aos aliados para que possamos eleger o maior número no segundo turno –"
"ofuxico.com.br","ela, desde que alugou o apartamento, estou desconhecendo, muito estranho para a minha cabeça. </s><s> Dizia que","era para nós ficarmos","um pouco lá e cá, tudo começou aí. </s><s> Antes de eu contrair a Covid-19, a gente começou a brigar muito, porque ela alugou um"
"ofuxico.com.br","para continuar a tradição de criar obras de arte e celebrar os acontecimentos marcantes da história da família real. </s><s> É","apropriado para nós lançar","uma moeda comemorativa, assim como fizemos no batizado do príncipe George"", explicou. </s><s> Vale lembrar que o batizado da"
"ofuxico.com.br","61 anos, pendurada à beira de um buraco no chão. </s><s> ""Era a cena do voodoo e eu estava presa, esperando ser resgatada por Bond. </s><s>","Era para nós descermos","em uma tumba juntos, mas tudo deu errado"", contou à revista Hello!. </s><s> ""A tumba era uma empilhadeira disfarçada e quando o"
"ofuxico.com.br","<s> ""Eu acho que não, ele sabe que eu sou profissional e sei que ele também é. </s><s> Acho que não dá espaço para ciúme. </s><s> Ele está feliz e","torcendo para nós fazermos","o melhor"". </s><s> Mas, na hora de gravar, Marina conta que cada um prefere manter o seu espaço, apesar de serem muito unidos: """
"unisinos.br","Francisco, esses bispos abordam direta ou indiretamente algumas perguntas desafiadoras para a própria Igreja. </s><s> O que","significa para nós considerar","as pessoas LGBT ""nossos irmãos e irmãs""? </s><s> De que forma os católicos criam desprezo pelas pessoas LGBT? </s><s> Onde podemos"
"unisinos.br","precisa mais de terra, que já está de bom tamanho, só precisa trabalhar"", conta a liderança Tupy Myky. ""A todo momento","pedindo para nós desistirmos",", que se a gente desistir eles estarão a nosso favor, vão em Brasília brigar com o governo para disponibilizarem"
"unisinos.br","e os comportamentos so uma resposta s indicaes sociais fornecidas por outras pessoas. </s><s> Conceit </s><s> ""Vigiar neste Advento","será para nós permanecer","fiéis na noite, vigiando para não transformar a pequena chama da nossa fé em um sol brilhante que cega a todos. </s><s> Que a noite"
"unisinos.br","mais à intimidade e ao silêncio da noite do que à praça lotada de pessoas ao meio-dia. </s><s> Vigiar, neste Advento, portanto,","será para nós saber","contar o Evangelho sem romper o silêncio da noite. </s><s> Jesus, no fim, faz de nós fiéis na noite à espera, e aquele que espera,"
"unisinos.br","artigo publicado no sítio do Mosteiro de Bose e reproduzido pelo IHU em 2016, mas atual para 2020. ""Vigiar neste Advento","será para nós permanecer","fiéis na noite, vigiando para não transformar a pequena chama da nossa fé em um sol brilhante que cega a todos. </s><s> Que a noite"
"unisinos.br","para os povos indígenas. </s><s> Desde a colonização todos os governos que passaram, tudo que aconteceu ao longo da história","serve para nós conhecermos","que nenhum desses governos apoiou os povos indígenas. </s><s> Nós temos que nos reorganizar, pensar em estratégias futuras"
"unisinos.br",", Morton publicou seu livro desafiando a ideia de ""natureza"", bem como sua continuação, em que questionava o que","significa para nós confiar","em inúmeros outros seres de forma insondável e complexa. </s><s> Ele também se juntou a um pequeno e controverso movimento"
"unisinos.br",", como cidadão que conhece a vida, como sexagenário, estudioso, professor, aceitar ideologia de gênero [...]. </s><s> Não","cabe para nós admitir","artificialidades. </s><s> Contra a ideologia de gênero é um dos nossos mais importantes valores, da família e da dignidade da"
"unisinos.br","um meio de obter apoio. </s><s> Neste ano nos reunimos para uma sessão que chamamos de ""Francos e Livres"", em que discutimos o que","significa para nós sermos","jovens, gays e católicos. </s><s> Nós tínhamos tanta coisa a dizer que, após a primeira reunião, decidimos fazer mais duas para"
"unisinos.br","dele. </s><s> Ora, isso aconteceu há alguns anos... nós ainda estamos esperando para ver quais serão as consequências, como","será para nós sermos","partícipes na Casa do Senhor, filhos e filhas com dignidade igual, todos participando num sacerdócio cujo único"
"nsctotal.com.br","estudar alternativas. </s><s> - Como Floripa Airport, não temos um plano B. Vamos inaugurar o aeroporto dia 1° de outubro. </s><s> Não","é para nós decidirmos","plano B, esse é um trabalho que cabe ao governo. </s><s> Nós, sim, vamos inaugurar e estamos otimistas de que o governo está"
"unisinos.br","de formação. </s><s> Na opinião do pescador tradicional Cláudio Araujo Nunes, membro da coordenação política, ""o curso vai","servir para nós apreendermos","a nos expressar perante nossas comunidades, conhecer as leis, planejar estratégias de luta, interagir com os outros"
"unisinos.br","não temos direito, mas nós sabemos que o governo não usa do Direito. </s><s> Fazendeiros já estão matando nossa mãe, e ela","pede para nós salvar","nossa mãe. </s><s> Parente Xokleng estão sofrendo como nós. </s><s> Pede: por favor, ajuda nós para salvar nossa terra! </s><s> Concluímos o"
"unisinos.br","é vazia, porém, uma vida que se preocupa das próprias necessidades, sem olhar para quem tem necessidade! </s><s> Se temos dons,","é para nós sermos","dom para os outros. </s><s> Neste ponto, irmãos e irmãs, perguntemo-nos: preocupo-me só das necessidades, ou sou capaz de"
"unisinos.br","dois pés; vai e volta. </s><s> Agora vocês estão vendo esse problema que o governo cria contra nós. </s><s> Essa portaria (1907/16)","é para nós ficarmos","brabos, nervosos para matar. </s><s> Na cultura Yanomami, quando quer guerrear, manda uma mensagem para a comunidade para"
"unisinos.br","de 24 de dezembro – e o foco é dado neste texto litúrgico (a partir da tradução da Liturgia das Horas): </s><s> Quem é Jesus que está","vindo para nós celebrarmos","? </s><s> Bem, aqui está uma resposta enraizada profundamente nas escrituras daqueles que foram seus primeiros seguidores (o"
"unisinos.br",". </s><s> Até porque os canais de comunicação com o movimento social foram obstruídos nesse último período. </s><s> Eles precisam ser","desobstruídos para nós recuperarmos","vitalidade de formulação. </s><s> Comunicar erro </s><s> close </s><s> ''Agenda Temer'' tenta pôr o Brasil de hoje na República Velha, diz"
"meutimao.com.br","que contratou o Ronaldo. </s><s> E sim o Ronaldo que quis o Corinthians. </s><s> Essa é a grande realidade. </s><s> O nível que ele tinha, não","era para nós contratar",", e sim ele aceitar. </s><s> Foi importantíssimo não só para ele mas também para o Corinthians. </s><s> Foi um case que nos próximos anos"
"unisinos.br","por um mundo melhor, um mundo que caminhe segundo o plano de amor de Deus para a humanidade e para toda a sua criação. </s><s> Que","significa para nós vigiar",", viver a atitude de vigilância atenta e confiante em meio a esta realidade? </s><s> Esta é uma pergunta que podemos responder"
"unisinos.br","irá prescrever reformas socioeconômicas específicas para o futuro mais justo que ele aguarda e deseja. </s><s> Tal trabalho","ficará para nós realizá-lo",". </s><s> O Papa Francisco não está interessado em mudar os sistemas políticos ou econômicos, e sim em transformar os corações;"
"meutimao.com.br","essas falcatruas continua Grande! </s><s> Mesmo com tanta grana saindo não se sabe para onde, continua desse tamanho... Isso","é para nós vermos","como a marca é resiliente e continuará sendo! </s><s> A profissionalização da gestão do futebol é uma das medidas que podem"
"nsctotal.com.br","do Norte. </s><s> Eles fizeram também um fatiamento das regiões, e como o Paraná e o Rio Grande do Sul já tinham sidos escolhidos,","sobrou para nós ficarmos","fora. </s><s> Mas eu lamento, acho que seria um grande crescimento para o Estado. </s><s> Nós temos condições de ter um bom estádio. </s><s> Como"
"unisinos.br","latino-americano, não devemos apequenar-nos em meros espectadores do que se passa no mundo. </s><s> Participar ativamente","importa para nós consolidar","e aprofundar as instituições da nossa democracia política, procurar as brechas no novo cenário internacional que se"
"unisinos.br","latino-americano, não devemos apequenar-nos em meros espectadores do que se passa no mundo. </s><s> Participar ativamente","importa para nós consolidar","e aprofundar as instituições da nossa democracia política, procurar as brechas no novo cenário internacional que se"
"unisinos.br",". </s><s> Abramos nosso coração nestes dias ao seu Amor para adentrarmos no seu amor misericordioso! </s><s> Celebrar esta festa","é para nós tomar","a decisão de acompanhar Jesus neste amor misericordioso e deixar que ele seja o impulso da nossa vida! </s><s> Como Jesus,"
"hojeemdia.com.br","e fomos de helicóptero. </s><s> Quando chegamos ao distrito de Bento Rodrigues, a área já estava destruída e havia pessoas","acenando para nós descermos","e ajudarmos. </s><s> Mas resolvemos seguir o fluxo do rio de lama e ir um pouco mais à frente, para Paracatu de Baixo"", registra"
"bemparana.com.br","maior para nós políticos do que o reconhecimento da população e ao mesmo tempo o apoio em todas as medidas que estão sendo","tomadas para nós resgatarmos","credibilidade na boa política, no sentido de fazer com que as populações mais vulneráveis tenham a mão estendida do"
"uol.com.br","homenagem. ""TBT de uma noite maravilhosa, com duas maravilhosas no aniversário da mila estrela, Juliana Paes. </s><s> Hoje","era para nós estarmos","assim né, coisa rica? </s><s> Mas, logo logo vamos comemorar com muitos beijos e abraços. </s><s> Felicidades, Juliana, amo tu"","
"uol.com.br","VENDO SEUS DELEGADOS CORAJOSOS SOFREREM PERSEGUIÇÃO. </s><s> AGEM PARA DESENCORAJAR. </s><s> A MAIORIA IGNORANTE COMANDA! </s><s> O QUE","RESTA PARA NÓS TERMOS","ESPERANÇA? </s><s> BASTILHA! </s><s> Em Reforma agrária </s><s> Em tempo: Não é à toa que o STF IMPEDIU A POLÍCIA FEDERAL DE DAR UMA ""GERAL"" NA """
"purebreak.com.br","gosta dos fios mais longos da atriz, não precisa se preocupar. </s><s> Afinal, o cabelo de Eleven em ""Stranger Things"" também","serve para nós termos","uma noção da passagem de tempo que rola durante a série. </s><s> Ou seja, é bem provável que as coisas não mudem por agora. </s>"
"uol.com.br","de amor, não podemos querer que sejemos felizes, sabendo que os outros estão tambem em busca dessa felicidade, o que","falta para nós compartilhar","? é amor , compreenção, paz, solidadriedade, e acima de tudo, a sabedoria e a inteligéncia de sabermos perdoar, e amar ao"
"uol.com.br","ofertas. ""Nós tivemos a impressão de que, com um empurrão de mais um metro de cada lado, as coisas estariam bem","encaminhadas para nós celebrarmos","[um acordo]"", afirmou Lamy. </s><s> PM prende traficante que ostentava arma com bebê no colo </s><s> Policiais militares já"
"douranews.com.br",", afinal de contas até bem pouco tempo atrás éramos conhecidos como celeiro do futebol, o que não acho justo é a conta","ficar para nós pagarmos",", um evento que quem ganha são emissoras de tv, empresários de jogadores, políticos aproveitadores e todas as empresas"
"uol.com.br","2 a 1 em casa no primeiro jogo das semifinais. </s><s> Vai ter que vencer no Santiago Bernabeu, escreve o Globoesporte.com. </s><s> ""Não","adianta para nós saber","apenas quem apertou o gatilho"", afirmou Talíria Petrone (RJ) a jornalistas na Câmara. </s><s> Segundo Marcelo Freixo (RJ), a"
"uol.com.br","quero te explicar: Jesus Cristo, é isso. </s><s> E é assim que tu vai ver eu ter 51_milhões de votos e ser eleito no primeiro turno. </s><s>","Espera para tu ver",". </s><s> O sr. acha possível chegar a esse percentual a dias da eleição? </s><s> Meu irmãozão, para Deus um dia é suficiente para Ele"
"conexaoto.com.br",". </s><s> ""Eu vou propor para Josi Nunes fazer uma PEC proibir um percentual dos eleitores paulistas e santa Catarina 40 anos sem","votar para nós ensinarmos","eles a votarem. </s><s> A votação deles no PSDB tem atrapalhado nosso país"", encerrou sendo aplaudido pelos presentes. </s><s> Aragão"
"uol.com.br","Civil é altamente militarizada no Rio."" </s><s> Uma declaração do cabo Arthur espelha esse efeito: ""Claro que tem vezes que","dá para tu prender",", mas tu vai e mata. </s><s> Não vou ser hipócrita. </s><s> A gente na UPP conhece cada vagabundo, já cansou de trocar tiro com ele, ele já"
"uol.com.br","de nossos impostos para benefício próprio. </s><s> Como Bolsonaro não será impedido, pois o centrão irá controlá-lo, só","restará para nós tirá-lo","do poder em 2022 pelo voto, como os americanos fizeram com seu mentor Donald Trump. </s><s> Lá se vão todas as promessas de"
"conexaoto.com.br","Jandira Feghali (PCdoB-RJ), líder da minoria. </s><s> ""Nós acreditamos que esse modelo de audiência pública é o modelo mais","apropriado para nós darmos","o máximo de transparência e discutir com a máxima serenidade os assuntos que dão de interesse da nossa comunidade"","
"uol.com.br",". ""O cenário ainda está em formação, não dá para avaliar o quadro com as pré-candidaturas. </s><s> Por enquanto precisa","avançar para nós termos","mais clareza da realidade local"", afirmou. </s><s> O secretário-geral do PSDB, deputado Silvio Torres (SP), acredita que, ao"
"conexaoto.com.br",". </s><s> Era um ótimo estilo de vida, inalcançável à maioria dos brasileiros. </s><s> Nada do que reclamar. </s><s> Mas, por mais duro que","seja para nós admitirmos",", existem em todos nós os vírus da ambição e da preguiça. </s><s> Sinceramente falando, quem não quer ganhar mais e trabalhar"
"uol.com.br",". </s><s> Pode ser uma UTI ou um leito mais isolado. </s><s> Aquele que recebe alta, é acompanhado ambulatorialmente durante um ano. ""","É para nós sabermos","se a doença deixa sequelas no pulmão ou no organismo. </s><s> Como a doença é nova, não sabemos"", afirma Carvalho. </s><s> Quem vai a"
"conexaoto.com.br",", com a denúncia da população. ""A orientação é sempre um caminho, mas neste caso, é um tipo de problema que precisa","acontecer para nós atuarmos",""", salientou. </s><s> Fiscalização </s><s> Já a Prefeitura de Palmas, responsável pela Guarda Metropolitana, informou que o"
"uol.com.br","ver a plateia lotada e ouvir os aplausos do público. </s><s> ""Esses aplausos fizeram muita falta. </s><s> Vocês não sabem a alegria que","é para nós poder","nos apresentar de novo para o público"", disse o maestro Davi Nunes, regente titular da Ovam há 11 anos, após o fim da"
"conexaoto.com.br","carência mas é porque não tem como fazer. </s><s> Eu até cobrei do prefeito uma área para fazermos a Associação nossa e o prefeito","disse para nós procurar","uma área que desse para fazer mas não tem, Taquaralto não tem. </s><s> E aí tem que ficar do jeito que está porque não tem como mudar"
"conexaoto.com.br","para que o caso fosse encaminhado para o Hospital Geral de Palmas. ""Disseram que não tinham médicos preparados e","era para nós irmos","para Palmas, mas, os enfermeiros que nos acompanharam desde Peixe não quiseram levar para Palmas porque não daria"
"uol.com.br","não viaja de avião, por isso a organização optou pela participação em vídeo. </s><s> E Maria Teresa chegou a ser agredida.""Isso","é para tu aprenderes","a não escrever como escreves"", ouviu ao ser agredida. ""Enfrentamos a censura, o poder político. </s><s> Aquilo tudo saiu do"
"se.gov.br","agravos. </s><s> Nós, como profissionais, devemos pensar como reduzir estes impactos na vida do trabalhador, pois o ofício","serve para nós evoluirmos","e não adoecermos. </s><s> Os profissionais de saúde do trabalhador têm o desafio de levar este olhar crítico para todos os"
"se.gov.br",", de conhecer as nuances do nosso território. </s><s> É um mapeamento muito detalhado do nosso público e das demandas que eles","trazem para nós dirimirmos",", no menor tempo possível, alinhado com outras políticas públicas para garantir o resgate da construção da cidadania e"
"se.gov.br","na modalidade home office e vejo a dificuldade de alguns gestores em conduzir as equipes remotamente, e a palestra","serviu para nós interagirmos","melhor com a tecnologia. </s><s> Alguns gestores ainda não estão aptos a utilizar ferramentas tecnológicas que facilitam na"
"se.gov.br","com o serviço de um CER"", esclareceu. </s><s> Sony destacou ainda a importância deste momento de acolhimento. ""Este momento","serve para nós situarmos","estes trabalhadores sobre o que é o Sistema Único de Saúde (SUS), o que é o CER, o que a gente espera, e qual a qualidade do"
"se.gov.br","as crianças. ""Todas as anomalias que encontramos encaminhamos às unidades de saúde para fazer tratamento. </s><s> Isso","serve para nós aguçarmos","o olho para tais problemas e facilita a nossa observação para quando formos profissionais"", opinou Cristian, que faz o"
"portogente.com.br","ultrapassa a barreira do real, utilizando os mais diferentes dispositivos que a tecnologia atual pode","oferecer para nós comunicarmos","de forma mais efetiva. </s><s> Toda essa mudança de paradigma social também é refletida nas cidades. </s><s> De acordo com uma pesquisa"
"purepeople.com.br","que está ganhando. </s><s> Ativa na internet em defesa de artistas, a sertaneja pediu mais empatia. ""As redes sociais são algo","feito para nós compartilharmos","a nossa vida, termos empatia pelo outro... Todo mundo pode usar, sabe? </s><s> Mas tudo o que vejo são julgamentos e críticas ao"
"ansabrasil.com.br","cultivar e proteger melhor as vinhas do Senhor, para cooperar com seus sonhos, ao seu projeto de amor ao povo. </s><s> O Senhor","pede para nós curarmos","as famílias, que desde o início é parte integrante sobre o Seu desenho de amor pela humanidade"", ressaltou o líder da"
"uol.com.br","que precise aguentar viagens diárias. </s><s> Elas só estão disponíveis nos EUA: ""o envio internacional é muito caro e muito","complicado para nós gerenciarmos","neste momento"", diz a campanha. </s><s> Dois outros modelos devem chegar em breve: um com uma bateria de 300 Wh que pode atingir"
"uol.com.br",", nós fomos até um Starbucks por perto – a pessoa responsável pelas fotos veio comigo. </s><s> Assim que entramos, os atendentes","pediram para nós pararmos","de filmar. </s><s> Claro, sem problema. </s><s> Mas eu deixei meu Glass gravando um vídeo enquanto fazia meu pedido e pegava um café. </s><s> Sim"
"uol.com.br","do Chrome, notando que uma leitura direta do Gerenciador de Tarefas do Windows pode não ser inteiramente precisa. </s><s> Não","dá para nós voltarmos","atrás e testarmos de novo com novas leituras do mesmo ambiente de testes, mas nos lembraremos da declaração do Google"
"olhardireto.com.br","de R$ 40_mil roubados de casa de deputada; veja fotos ""Lá tá fácil, tem o funcionário da casa que deu o canal. </s><s> Esse canal já","era para nós ter","pegado desde o mês passado para fazer o povo de refém. </s><s> O povo viajou, o cofre tá lá, a maleta com o dinheiro tá lá, é só"
"olhardireto.com.br",", também está discutindo, então as discussões começaram hoje e vamos fazer uma avaliação lá por quinta- feira se vai","dar para nós fecharmos","dentro do prazo estimulado ou se suspende o recesso"". </s><s> A distância entre Hotel Lisboa e Miramar Hotel & SPA é de aprox."
"uol.com.br","história e vamos para a avenida com um carnaval que dará orgulho aos nossos componentes, torcedores e ao público que lá","estará para nós prestigiar",""", diz a nota publicada nas redes sociais da agremiação. </s><s> Iza foi coroada Rainha em novembro com uma grande festa na"
"uol.com.br","e não economizaram nos elogios: ""Vamos sair dos agrotóxicos! </s><s> Parabéns Túlio e Fátima!"", disse uma. ""Esse casal","veio para nós ensinar","!"", elogiou outra. </s><s> Fátima Bernardes fez elogios ao namorado, Túlio Gadêlha no Encontro. </s><s> Incêndio destrói galpão de"
"olhardireto.com.br","é uma pena, o Brasil estava dando uma andada bacana, os empresários voltando a acreditar, os investimentos voltando a","retornar para nós retornar","o emprego no país. </s><s> Então o que eles fizeram foi uma sacanagem das grandes levar esse caos que está levando ao Brasil, mas o"
"radiogaucha.com.br","de 10 jogos este ano e também tem os treinos. </s><s> Acho que não (desentrosa). </s><s> O Celso está poupando alguns jogadores. </s><s> Isto","é para nós sermos","mais eficientes nos jogos decisivos. </s><s> Temos que acatar, mas o pensamento de todos os jogadores é atuar sempre – declara o"
"radiogaucha.com.br","Titi. </s><s> – Eu queria agradecer a torcida do Criciúma, a diretoria, que não deixou faltar absolutamente nada parte física,","deu para nós desenvolvermos","bem o nosso trabalho. </s><s> O criciúma é muito grande e oxalá possa conquistar esse título (catarinense) – concluiu o"
"radiogaucha.com.br","todos os recursos aprendidos em três décadas de futebol para elogiar o Juventude, além de alfinetar o Inter e Luigi. </s><s> –","Caiu para nós enfrentar","o pior adversário possível neste momento. </s><s> Será um jogo muito difícil. </s><s> Será dado todo o respeito ao Juventude. </s><s> Até"
"uol.com.br","apenas entreguem fôlder à população. </s><s> Eles vão conversar com as pessoas nas casas, nos shoppings e no metrô. </s><s> Hoje também","serve para nós levantarmos","focos do mosquito para que, na segunda-feira, possamos iniciar a terceira fase do trabalho, que é o combate ao"
"suasnoticias.com.br",": É, a hora que Deus quiser. </s><s> Leandro: Não é pela tua boca. </s><s> Bernardo: Tu vai morrer. </s><s> Leandro: Me respeita! </s><s> Bernardo: Vou","rezar para tu morrer",". </s><s> Graciele: Então vai, te ajoelha. </s><s> Leandro: Tu vai ficar 20 anos rezando. </s><s> Quanto mais tu rezar, pior vai ser. </s><s> Mais eu vou"
"suasnoticias.com.br",". </s><s> O entendimento foi de que, quando um pai solteiro adota, ele é pai e mãe. </s><s> Valeu! </s><s> Não ria muito, porque da pantomina vai","sobrar para nós pagarmos","a despesa: Uma deputada federal gaúcha está com viagem marcada para participar, na China, de um seminário sobre ("
"suasnoticias.com.br","o desabamento parece ter ocorrido dificulta ainda mais as buscas. ""O volume de material é muito grande. </s><s> A essa altura já","era para nós termos","encontrado mais corpos, mas a sobreposição das lajes efetivamente é um dificultador"", avaliou. </s><s> Polícia abre"
"jornaldopovo.com.br","no terceiro dia das manifestações dos meus amigos caminhoneiros - quem já foi um dia caminhoneiro nunca deixa de sê-lo -","deu para tu entenderes","o tamanho da bobagem que digitastes? </s><s> PTitica de galiáceos </s><s> Edson Bonini, o que tem então na cabeça dos idioPTas, que"
"jesocarneiro.com.br","do jeito que é. </s><s> Juruti ainda não trabalhei lá, por causa do salário que me ofereçam, muito abaixo da minha média. </s><s> Vou te","situar para tu aprenderes","onde fica Ourilandia do Norte-PA, localiza-se na região sudeste do nosso Estado, há exatamente 988km de distancia da"
"jornaldopovo.com.br","de fora do ginásio até a chegada dos ingressos. </s><s> Os responsáveis pelo acesso ao ginásio eram ligados ao próprio Gerbac. ""","Disseram para nós sair","e retornar depois, mas o adversário já estava até nos vestiários"", disse Teco. </s><s> Hoje, o treinador deverá se reunir com a"
"jesocarneiro.com.br","se formaram com as chuvas, além da falta de iluminação pública. </s><s> Trabalho do novo prefeito eu não vi, mas o carnê do IPTU já","chegou para nós pagarmos",". </s><s> Fica o meu protesto. </s><s> CADÊ os Vereadores? </s><s> Na mão do Prefeito? </s><s> ATÉ HOJE NÃO COMEÇOU O RECAPEAMENTO da TOMé de Souza ("
