"corpus","preloaded/pttenten20_fl5"
"subcorpus","-"
"concordance size","231"
"query","Query:[tag=""V.*""][lemma=""para""][lemma=""nós|tu|vós|vocês|eles|elas""][tag=""V.N.*""] within <doc (genre=""news"") & (tld=""br"") />"
"Reference","Left","KWIC","Right"
"pt.org.br","a militância. ""Nós estamos aqui e Lula é o nosso candidato a Presidente da República. </s><s> Somos milhões de Lulas, como ele","pediu para nós sermos",". </s><s> Quando saímos do sindicato dos metalúrgicos, aonde nascemos, Lula nos disse: ''cada um de vocês vai ser eu, vou pensar"
"pt.org.br","do Sul: uma pessoa, com uma machadinha, adentrou uma escola e, por sorte, não aconteceu uma tragédia maior. </s><s> Então, não","dá para nós ficarmos","estimulando, facilitando que o porte de arma ocorra de qualquer maneira"", afirmou ele, sobre o projeto que segue para"
"pt.org.br","do PT, das mulheres do novo Diretório Nacional, além das senadoras, deputadas federais e estaduais do PT. </s><s> ""A reunião","servirá para nós conversarmos","sobre o futuro do PT e das mulheres do partido, tendo agora uma mulher à frente do PT. Vamos trocar idéias para avançarmos"
"ufo.com.br","de vocês e sabemos da simpatia daqueles que testemunham a nossa missão. </s><s> Queríamos que vocês soubessem a ajuda que isso","representa para nós ter","avenidas luminosas que nos permitam atingir as regiões mais sombrias, onde se deve fiscalizar tanto trabalho. </s>"
"uai.com.br","""projeto de casal"" – a sócia, majoritária, é a esposa, Bia Corrêa do Lago. ""Estamos editando livros que gostaríamos que","existissem para nós comprarmos",""", brinca. </s><s> Áreas a se desbravar são, na opinião dele, a fotografia e a pintura do século 19. </s><s> O próximo trabalho vai ser"
"cimm.com.br","com fornecedores locais ao passo em que a cadeia for se desenvolvendo. ""Quanto mais madura for a cadeia, mais fácil","será para nós terceirizar","."" </s><s> Com 8 desfalques, jogando fora de casa e ainda saindo tomando um gol no início. </s><s> O Botafogo comprovou mais uma vez sua"
"uipi.com.br",", em Volta Redonda (RJ). </s><s> – Um clássico é sempre especial, mas vale três pontos tanto quanto os outros oito jogos que ainda","faltarão para nós disputarmos","depois dele. </s><s> É claro que na questão psicológica é um diferente. </s><s> Tem a história do Fla-Flu. </s><s> Espero que seja uma grande"
"mises.org.br","deles honesta e eleição não passa de um circo de palhaçadas e nós os inocentes úteis deste sistema perverso. </s><s> A bíblia","diz para nós abençoarmos","as autoridades e odiarmos os pecados cometidos por elas ou seja nós devemos abençoar todos os políticos enquanto seres"
"mises.org.br","com revólver de brinquedo em vez de ler poemas e conversar com plantas. </s><s> Tudo isso é culpa de vocês, seus canalhas! </s><s>","Era para nós cuidarmos","da alma daquele policial, mas ele foi tão vítima quanto Marielle: Ele foi vítima da religião, ele foi vítima da indução"
"mises.org.br","do discurso de ódio; ele decidiu brincar com revólver de brinquedo em vez de ler poemas e conversar com plantas. [...]","Era para nós cuidarmos","da alma daquele policial, mas ele foi tão vítima quanto Marielle: Ele foi vítima da religião, ele foi vítima da indução"
"mises.org.br","iremos demorar um pouco antes de pedirmos outra rodada. </s><s> Algumas pessoas que estão sentadas às mesas ao lado começam a","direcionar para nós olhares","complacentes quando um de nossos interlocutores, espumando pela boca, grita que eu estou agindo de má fé e afirma que"
"mises.org.br",", ela não poderia ir sozinha para a serra e deixar que os outros três fossem para a praia – afinal, ""deu praia"" na eleição. </s><s> E","era para nós acharmos","o vídeo sublime! </s><s> Adaptando o vídeo para as eleições atuais, imaginem que o destino da viagem fosse escolhido por uma"
"lance.com.br",". </s><s> A ida ou não à Libertadores afeta nesse orçamento, nesse planejamento? </s><s> Afeta, é muito importante. </s><s> A ida é o que","falta para nós sentarmos","e decidirmos fazer certas ações. </s><s> Não indo à Libertadores você tem Campeonato Paulista, algumas cotas, mas bilheteria"
"lance.com.br","esse longo feitiço com resultados insatisfatórios. </s><s> O que precisamos agora é um resultado positivo, o mais importante","é para nós voltar","ao caminho das vitórias. </s><s> RB LEIPZIG VISITA O HOFFENHEIM </s><s> De olho em um tropeço do Bayern, o vice-líder RB Leipzig encara o"
"pedal.com.br","o guiné fala. </s><s> olha vai chegar ums adesivos muito loucos de bike principalmente extreme loucos mesmo, quando chegar ti","ligo para tu ir","pegar lá em casa, ok ? </s><s> eu comecei com 1 caloi aspem com suspa gts m3 adptada, um lixo, mas foi com ela que comecei na carreira"
"lance.com.br","de ter admitido que estava de saída, desta vez mudou o tom e falou como se fizesse parte do elenco para 2016/17. </s><s> - Ainda","dói para nós estarmos","nesta situação depois de termos sido campeões na temporada passada. </s><s> Não estivemos aqui hoje para derrotar o Tottenham"
"lance.com.br","campeões na temporada passada. </s><s> Não estivemos aqui hoje para derrotar o Tottenham e impedí-los de levarem o título,","dói para nós fazermos","isso para o Leicester. </s><s> Mas estaremos de volta no ano que vem - concluiu Terry. </s><s> No duelo que marcou o reencontro de Luis"
"lance.com.br","si para conquistar o torneio. </s><s> - O resultado foi perfeito para nós. </s><s> Reforça a situação, o momento atual, e é maravilhoso. </s><s>","Resta para nós confirmar","isso nas rodadas que restam, que serão as mais importantes - disse Luis Enrique em entrevista coletiva: </s><s> - O que mais"
"dgabc.com.br","os ""esquerdistas"" a saírem do imobilismo. ""Estou de novo na trincheira da luta. </s><s> Agora não é mais do Lula livre. </s><s> Agora","é para nós voltarmos","e retomarmos o governo do Brasil. </s><s> Nós somos petistas, de esquerda e socialistas"", convocou. </s><s> Os discursos animaram a"
"terra.com.br","sendo feito por nós pode ter certeza que é o mais certo possível, pensando não só sábado, mas no futuro do Santos. </s><s> Quanto","vale para nós termos","21 aqui e 17 serem da base? </s><s> Terminar o jogo com quase todos da base jogando, pegando corpo no Mineirão contra o Galo"
"dgabc.com.br","campo não fizessem o mesmo em torno de um único projeto. ""Nós já fizemos o gesto. </s><s> Se eu não for candidata, os outros três se","entendem para nós estarmos","unidos? </s><s> A unidade da esquerda representa isto: nós estaremos todos unidos em uma única candidatura? </s><s> Os outros três têm"
"terra.com.br","na Série A. Tenho certeza que o Marcão irá mostrar mais uma vez que tem competência para estar onde ele está. </s><s> O que","falta para nós vencermos","é caprichar nas definições das nossas jogadas, sermos mais verticais, mais agressivos - avaliou. </s><s> Criado pelo"
"dgabc.com.br","Palhavam disse que a equipe está preparada para tudo. ""É briga direta pelo G-4. </s><s> Essa oscilação na escalação do Santos","dificulta para nós sabermos","qual será a postura deles, mas vamos tomar cuidado, esperar uns minutos para ver definição em campo e depois impor nosso"
"dgabc.com.br","avaliação de Rocha, o regime de capitalização, proposto por outras candidaturas, pode sofrer em momentos de crise. </s><s> ""É","complicado para nós adotarmos","esse porque nossa história recente mostra que em 20, 30 anos temos grave crise, que pode impactar esta capitalização"","
"dgabc.com.br","parceria Público-Privada (PPP) para a construção e gestão do espaço. </s><s> ""Estamos muito felizes com a oportunidade que se","abriu para nós levarmos","o automobilismo de base a um espaço como esse. </s><s> A Bahia, sua cultura, seu povo e sua alegria são especiais e a"
"ce.gov.br","uma apresentação emocionante para marcar esse momento de partilha e que nos faz relembrar o sacrifício que Cristo","fez para nós salvar",""", enfatizou Amanda. </s><s> Movimentação Conversando com o deputado Fernando Santana (PT), vice-presidente da Assembleia"
"terra.com.br","securitização de ativos não impactava no déficit primário. </s><s> Acho que finalmente aceitaram a nossa proposta, porque","é para nós realizarmos","a travessia desse momento enquanto aprova as nossas medidas"", disse. ""Cansei de falar que eu não estava inventando a"
"terra.com.br","o governo Bolsonaro, afora sua postura autoritária, é o fato de ele ter demorado três meses para agir. </s><s> Nesse momento, já","era para nós estarmos","entrando em uma segunda fase. </s><s> Minha maior preocupação é com as vidas das pessoas que podem morrer por falta de atenção do"
"aepet.org.br","erradamente, beneficia às patrocinadoras. </s><s> E prejudica o nosso plano. </s><s> A conta dessa gestão desastrosa está sendo","apresentada para nós pagarmos",". </s><s> Chama-se déficit técnico e Plano de Equacionamento paritário absurdo que a Petros nos apresenta e que será efetivado"
"terra.com.br","destaques da equipe. ""Entendo o Marcos porque ele tem muita responsabilidade por ser o goleiro da Seleção. </s><s> Ele tem que","pedir para nós corrermos","mesmo"", diz. </s><s> O técnico Márcio Araújo até elogiou o comportamento do goleiro. ""Gosto muito do Marcos porque ele fala o"
"aepet.org.br","para a tomada de uma decisão tão importante. ""Nossa iniciativa teve como origem a forma como o projeto repentinamente","chegou para nós decidirmos",", com um prazo pouco superior a um dia. </s><s> Preventivamente, dissemos que não vamos tomar uma decisão dessa envergadura de"
"terra.com.br","em São Paulo. </s><s> Às 19h15, Candinho falou, pelo telefone, com a Agência Estado. ""Se o Ricardo Teixeira nos demitir, mas","pedir para nós dirigirmos","a seleção na partida com a Venezuela, vamos dirigir. </s><s> Não vamos deixar o barco à deriva"", afirmou Candinho, aparentando"
"terra.com.br","não deveria ser essa. </s><s> Para mim, isso tudo é novo, nunca passei por uma situação assim. </s><s> Mas ainda tem muitos jogos,","dá para nós reagirmos",". </s><s> Temos que ter a cabeça no lugar, ficar tranqüilos. </s><s> Temos condições de mudar"", falou o jogador. </s><s> Para ele, o técnico"
"terra.com.br","precisamos trabalhar em cima dela. </s><s> O nosso próximo compromisso será frente o Guarani e a vitória contra o Santa Cruz","servirá para nós entrarmos","mais tranqüilos em campo. </s><s> Já demos o primeiro passo, que era o mais difícil, agora é só embalar"", finalizou Roger. </s>"
"terra.com.br","isso mesmo. </s><s> Agora estou com erro no Signature Method. </s><s> Alguem vê algo errado? </s><s> ""Depois do susto, o grupo mudou o espírito. </s><s>","Serviu para nós crescermos","na partida. </s><s> Mostramos um alto poder de superação. </s><s> Estivemos taticamente bem no confronto de hoje"", disse o técnico do"
"terra.com.br","que seu ex-pupilo perca a final do Aberto da Austrália no domingo, disse o jornal sueco Dagens Nyheter neste sábado. </s><s> ""Se","é para nós continuarmos","trabalhando juntos, é provavelmente melhor que ele perca a final"", disse Wilander ao jornal. </s><s> Wilander disse que a"
"redegn.com.br","Torres </s><s> 27 de Aug / 2010 às 21h09 </s><s> É isso ai Carlos Brasileiro. </s><s> Conte com o nosso apoio. </s><s> É de pessoas como você que precisamos","eleger para nós representar","na assembéia legislativa. </s><s> Um abraço </s><s> Eita sem Juizo </s><s> 28 de Aug / 2010 às 07h29 </s><s> Eita dois sem Juizo,estes dois rapaz não tem"
"guiame.com.br","tornou o modelo perfeito a ser seguido. </s><s> Portanto o ser perfeito está lá atrás e não lá adiante. </s><s> Aquilo que a ciência puder","fazer para nós devolver","esta originalidade será muito bem aceita. </s><s> No entanto, suas ações e invenções que nos afastem ainda mais do ser original"
"guiame.com.br","do Eterno na nossa direção para que nós sejamos abençoados e restituídos. </s><s> Enquanto o ímpio está plantando, ele vai","perder para nós podermos","ganhar, porque isso é uma regra básica para o Eterno. </s><s> Está escrito na Palavra que o ímpio plantaria para que o justo"
"guiame.com.br","o show é muito bonito. </s><s> Creio que nós também temos que aprender e desenvolver isso no lado gospel"", afirma o cantor. ""Isso","serve para nós mostrarmos","a Reino de Deus? </s><s> Não. </s><s> O Reino de Deus não é mostrado através de templos, igrejas bonitas ou shows, mas sim, através da"
"guiame.com.br","que ele puxou debaixo de seu colete. </s><s> Assim que minha prima e eu vimos a arma, nos escondemos atrás da minha mãe, que","gritou para nós fugirmos","; o terrorista atirou no braço de mamãe, enquanto ela tentava nos proteger; enquanto nós fugíamos, ela caiu e a"
"guiame.com.br","precisam estar dispostos a correr riscos e sentir-se à vontade para desconfortar, a fim de alcançar as pessoas que Deus","tem para nós alcançarmos",". ""Temos que começar a amar - realmente amar - outras pessoas se quisermos que elas saibam a verdade sobre quem é Deus e o"
"guiame.com.br","quarto. </s><s> E é incrível como Deus nos leva de volta para lugares por onde a gente já passou e refaz aquele caminho. </s><s> Não","é para nós torturar",", não é para nos mostrar o quanto aquele tempo era bom. </s><s> Mas, é para nos mostrar que assim como ele foi fiel naquele tempo ele"
"guiame.com.br","<s> Ele também comentou sobre a abertura que alguns cantores gospel têm na mídia secular. ""É uma oportunidade que Deus está","dando para nós usarmos","essa abertura para falar do Evangelho. </s><s> Essa é a nossa mensagem. </s><s> Nosso assunto maior é Cristo, não existe tema mais"
"guiame.com.br",". </s><s> Eles estavam falando espanhol. </s><s> Eu estava muito confuso. </s><s> Foi quando eu vi o médico da Chapecoense que eu me lembrei que","era para nós jogarmos","a final"", explicou. </s><s> ""Eu disse: ''Doutor, o que aconteceu no jogo? </s><s> Eu me machuquei?''. </s><s> Ele disse: ''Sim, Neto, você se"
"guiame.com.br","de uma galinha preta ou cordeiro, nem com o dízimo, nem mesmo com suas boas ações. </s><s> O padrão dessa força/pessoa é muito","elevado para nós satisfazerem",". </s><s> Até para um jedi! </s><s> Para nos aproximarmos dessa força/pessoa é só com um coração humilde, na fé que Sua infinita"
"conjur.com.br","! </s><s> Qual categoria goza de tamanha segurança? </s><s> Pessoas comuns trabalham, com ou sem vírus! </s><s> Talvez esta praga","sirva para nós mostrar","que a autotutela, apesar de ser primitiva, é mais eficiente do que a Justiça. </s><s> Goebbels, de novo! </s><s> Virou uma certa mania,"
"conjur.com.br","uniformizar com o que há de melhor? </s><s> Agora querem transformar o projudi em pje. Não durmo só ao pensar nisso. </s><s> O que devemos","fazer para nós ouvirem","? </s><s> Duvido que exista alguém que não vote pela uniformização com o e-proc! </s><s> e-proc </s><s> O e-Proc é excelente (simples e"
"conjur.com.br","a condenados reincidentes que causaram prejuízos bilionários aos contribuintes. </s><s> Como se vê, a conta está sendo","apresentada para nós pagarmos","e, desta vez, virá tão salgada que não teremos tempo nem de reclamar mais, pois todo nossos esforços serão para"
"folha1.com.br","até agora. </s><s> O Governo Federal (Dilma) até hoje não nos enviou o repasse referente a novembro/2015, e à cada dia, fica mais","complicado para nós mantermos","uma unidade regional, com atendimento de 14 municípios do Noroeste. </s><s> O futuro a Deus pertence, mas a nossa parte,"
"conjur.com.br","empresas estão deixando o Brasil. </s><s> Outras nem pensam em vir para cá. </s><s> Afinal, não gostamos de riscos. </s><s> Os outros que o","façam para nós pagarmos","as contas. </s><s> Em um país carente de tudo, o grande sonho é ser funcionário público de alto escalão. </s><s> Uma nação eternamente """
"folha1.com.br",". </s><s> E a expectativa é de ampliar este ano, implantando mais duas modalidades tênis de mesa e capoeira. </s><s> – É muito","orgulho para nós poder","oferecer esse projeto para as pessoas com deficiência que viviam à margem da sociedade. </s><s> Em menos de dois anos, eles"
"senado.leg.br","sabatina. </s><s> Eu só queria saber se isso vai ser realizado este ano, haja vista que a disponibilidade da agenda do que está","previsto para nós trabalharmos","não está contemplando reuniões de comissões. </s><s> Queria saber se o senhor está programando, se o senhor vai conversar com o"
"senado.leg.br",", afinal, o que a maioria dos homenageados faz de forma voluntária e abnegada, para servir e defender quem mais precisa,","é para nós parlamentares","um dever constitucional – disse Leila. </s><s> O mesmo ressaltou o senador Alessandro Vieira (Cidadania-SE), que presidiu a"
"senado.leg.br","os objetivos desse Governo Federal, que foi eleito nessa questão de eficiência do Estado, sejam respeitados e sejam","levantados para nós fazermos","esse bom combate. </s><s> Muito obrigado pela paciência. </s><s> Um grande abraço a todos! </s><s> Saudade de vocês, espero revê-los muito em"
"senado.leg.br","significa a vida neste ano de 2020. </s><s> Nunca foi tão presente a fragilidade da vida como neste ano de 2020. </s><s> E talvez isso deva","servir para nós refletirmos","diante da fragilidade da vida o que nós devemos fazer nessa passagem. </s><s> Nessa passagem aqui, a maior riqueza que nós"
"senado.leg.br",", todos nós unidos para fazer o Brasil voltar a crescer, para que o emprego possa retornar. </s><s> Que essa vacina possa ser","produzida para nós vacinarmos","desde o mais idoso até a menor idade, nós podermos vacinar todos os brasileiros... </s><s> Eu encerro, Presidente, já tarde da"
"senado.leg.br",", como está. </s><s> O espelho é esse. </s><s> Essa é a realidade e nós estamos sabendo. </s><s> Eu acho que esse é um direito de todos e vai","facilitar para nós abrirmos",", como se diz na gíria, a caixa-preta que existe, principalmente na questão da mobilidade urbana. </s><s> Isso vai servir para"
"senado.leg.br",", nessa matéria, como foi relatada pelo Relator da matéria Senador Antonio Anastasia... Eu vejo que o Senado se","movimentou para nós votarmos","essa emenda constitucional. </s><s> Eu queria pedir aos Senadores, se houver um entendimento, que nós pudéssemos, em seguida"
"senado.leg.br","ficasse 15 dias, que é um prazo razoável que foi pedido pelos Líderes parlamentares aqui nesta sessão, e essa matéria","voltasse para nós votarmos",". </s><s> Se derrotarem ou vencerem o projeto, nós deliberaremos sobre ele. </s><s> Então, eu queria fazer um acordo com o Plenário,"
"senado.leg.br",", alguma orientação? </s><s> Acredito que não. </s><s> Portanto, Sr. Presidente, esta multa que trago ao conhecimento do Senado","serve para nós percebermos","que não é apenas com uma legislação ambiental que estabelece multas exorbitantes, que não é apenas a rigidez da lei que"
"senado.leg.br",", para a assistência social no nosso País? </s><s> Aonde poderemos chegar com esses cortes na assistência social? </s><s> Não","dá para nós admitirmos","! </s><s> O que está acontecendo? </s><s> A gente vê a todo o momento... Parece que está brincando de governar. </s><s> Cada fala do Presidente"
"senado.leg.br",". </s><s> Faço aqui minhas as palavras do Senador Mozarildo quando se manifestou sobre o reingresso de V. Exa aqui. </s><s> É muito","orgulho para nós recebermos","figura tão ilustre, Ministro da melhor estirpe, político sem a menor jaça, de volta a esta Casa. </s><s> Sei que Minas está lhe"
"senado.leg.br",", eminente Senador da República Zequinha. </s><s> Mas serei muito breve, Sr. Presidente. </s><s> O que me traz à tribuna na tarde de hoje","é para nós falarmos","sobre a PEC 98. </s><s> Eu reputo da maior importância essa PEC, pelo fato de estarmos, com certeza, melhorando a vida dos"
"senado.leg.br","eu quero deixar bem claro -, nós estamos protelando a solução da crise econômica, política e ética do nosso País, porque","era para nós estarmos","discutindo aqui alternativas. </s><s> O impeachment é a solução do confronto, interessa os dois grupos que estão se"
"senado.leg.br","Unidos pelo Brasil/PP - RS. </s><s> Pela ordem.) – E com relação à terra para estrangeiros? </s><s> Também é uma matéria importante. </s><s> Não","dá para nós ajustarmos","com relação a esse projeto do Senador Irajá? </s><s> O SR. PRESIDENTE (Davi Alcolumbre. </s><s> Bloco Parlamentar Vanguarda/DEM - AP)"
"senado.leg.br",", e eu vou dar um ensinamento para que eles não repitam a besteira de se imiscuírem aqui, querendo fazer leis. </s><s> Leis","são para nós fazermos",". </s><s> Nós temos que fazer recuar o Presidente de mandar as medidas provisórias, que são leis indevidas, e não abrir mão. </s><s> E"
"senado.leg.br","ter que realizar, rápida. </s><s> E eu preciso devolver o que nós fizemos para os sub-relatores e, depois que eles aprovarem, me","devolverem para nós publicarmos","com 48 horas para votação. </s><s> A nossa programação original, Presidente, era: fazemos a reunião hoje; eu pediria que os"
"senado.leg.br","a reativar um pouco, vai animar, vai fazer com que você levante com mais ânimo, com que você levante dizendo: ""Olha,","dá para nós enfrentarmos","melhor, vamos mais para frente"". </s><s> Acho ajuda muito os ânimos, espírito para cima é melhor do que estar com a cabeça baixa. </s>"
"senado.leg.br","das indenizações devidas, pagamento esse que só seria efetuado após a manifestação do Judiciário. </s><s> Por isso,","temos para nós ser","da maior importância que a decisão do Superior Tribunal de Justiça, que firmou jurisprudência sobre a espécie, seja"
"senado.leg.br",", é da vida parlamentar; o Deputado também. </s><s> Mas, neste momento, o nosso Presidente – V. Exa é da Mesa Diretora – nos","convocou para nós estarmos","aqui. </s><s> Se nós não estamos aqui e não há o mínimo de um sexto aqui, nós não podemos começar a sessão. </s><s> E o §1o do art. 28 é claro. </s><s> O"
"senado.leg.br","de estar com a Presidenta Dilma, o Ministro Ricardo Berzoini, o Ministro Jaques Wagner, a Ministra Izabella Vieira","foi para nós tratarmos","especificamente da crise que toma conta hoje do meu Estado de Roraima. </s><s> Eu falei para a Presidenta que Roraima, quando"
"senado.leg.br","educação e a nossa cultura. </s><s> O Governo não tem o direito de julgar por nós, não tem o direito de escolher qual a versão mais","adequada para nós compreendermos","a realidade. </s><s> O Governo não pode nem imaginar que pode tutelar a nossa liberdade de compreender um fato e assim julgá-lo e"
"senado.leg.br","Rose, apesar do pedido do Senador Jorginho, naturalmente eu vou aquiescer e ceder a palavra a ela para que ela se","manifeste para nós começarmos","o item 2, que é um item em que aparentemente há unanimidade, pelo que me foi comunicado, e que nós poderíamos votá-lo de"
"senado.leg.br","provisórias, quanto mais governado por vetos. </s><s> E que venham para cá propostas para gerar emprego, que venham aqui","propostas para nós podermos","avançar nos problemas da saúde. </s><s> É isso que quer o povo. </s><s> É isso que topa dialogar o Congresso, mas infelizmente o Governo"
"senado.leg.br","mais importantes do que as emendas individuais, porque elas resultam de deliberação. </s><s> Ainda ontem a bancada mineira se","reuniu para nós estabelecermos","as nossas prioridades. </s><s> Então, não podemos ser tratados de uma forma desairosa, desrespeitosa, que tire recursos da"
"senado.leg.br","que mais representa contra todo o mundo, que haveria de estranhar alguém representar contra alguém do PSOL. </s><s> Não","daria para nós imaginarmos","que estaria nascendo um outro PT intocável até chegar ao poder, e, no poder, as pessoas mudam às vezes, enfim. </s><s> Eu"
"senado.leg.br","dele, como, por exemplo, a obrigatoriedade de as crianças terem acompanhamento na unidade básica de saúde,","contribuíram para nós reduzirmos","a mortalidade infantil. </s><s> E essa decisão da Presidenta foi fundamental, porque, nos últimos anos, nós tivemos uma"
"senado.leg.br","for o caso, o próprio empregador pode pagar uma parte – é a proposta que o Cid coloca –, e eu concordo com essa tese. </s><s> O que não","dá para nós fazermos",", nessa reforma, é acabar com o regime de repartição e ficar esperando o que o Governo vai mandar para o trabalhador, que"
"senado.leg.br","acertar com o Deputado Luiz Carlos Hauly, ex-Deputado, que tem um projeto que V. Exa. e 65 Senadoras e Senadores","assinaram para nós iniciarmos","a discussão da reforma tributária. </s><s> Tanta a previdenciária quanto a tributária são pontos fundamentais para"
"senado.leg.br",", na Vila Militar – o General Braga Netto –, na qual disse que o uso abusivo, o uso daquele recurso que a Constituição","estabelece para nós fazermos","– a GLO (Garantia da Lei e da Ordem) – funcionava como uma cortina de fumaça – e não podia ser assim – por políticos ou pela"
"folhape.com.br",", como cidadão que conhece a vida, como sexagenário, estudioso, professor, aceitar ideologia de gênero [...]. </s><s> Não","cabe para nós admitir","artificialidades. </s><s> Contra a ideologia de gênero é um dos nossos mais importantes valores, da família e da dignidade da"
